title,language,country,id,year,first _author_last_name,first _author_first_name,first _author_initials,last _author_last_name,last _author_first_name,last _author_initials,id,abstract
The dichotomy (generation of MAbs with functional heterogeneity) in antimalarial immune response in vaccinated/protected mice: a new concept in our understanding of the protective immune mechanisms in malaria.,eng,United States,24632591,2014,Singh,Prati Pal,PP,Prakash,Bhanu,B,24632591,"Globally, vaccines have emerged as one of the most effective, safe, and cost-effective public health interventions, and are known to save 2-3 million lives, annually. However, despite various commendable efforts, a suitable human malaria vaccine is yet to see the light of the day. The lack of our complete understanding of the molecular mechanisms of pathogenesis and immune protection in malaria appears to be responsible for this state. Earlier, our laboratory has reported that Swiss mice vaccinated with Plasmodium yoelii nigeriensis-total parasite antigens soluble in culture medium and saponin, following a 100% lethal challenge, showed 60% protection. The monoclonal antibodies (MAbs) generated from the splenocytes of these vaccinated/protected mice, following characterization by in vitro merozoite invasion inhibition assay, ex vivo macrophage phagocytosis assay, and in vivo passive transfer of protection test, belonged to 2 distinct groups-a larger group of MAbs inhibited&lt;58% Mz invasion and transferred 30% passive protection, whereas a smaller group of MAbs inhibited 86% Mz invasion and transferred 60% passive protection. Additionally, the MAbs of the smaller group, as compared with the larger one, mediated nearly 2.4-fold enhanced macrophage phagocytosis of infected-erythrocytes, in vitro. These results thus clearly showed a dichotomy among the generated MAbs. An exploration of the phenomenon of dichotomy in protective immunity in malaria by using various hosts and malaria parasite combinations, especially at the level of antibodies, cells, and cytokines, may add new insights to our understanding of the protective immunity, and help in the identification of biomarkers/biosignatures of immune protection and development of future human malaria vaccines."
"Cost-effectiveness analysis of vaccinating children in Malawi with RTS,S vaccines in comparison with long-lasting insecticide-treated nets.",eng,England,1475-2875-13-66,2014,Seo,Mikyung Kelly,MK,Ngo,Karen Ngoc-Lan,KN,1475-2875-13-66,"BACKGROUND: New RTS,S malaria vaccines may soon be licensed, yet its cost-effectiveness is unknown. Before the widespread introduction of RTS,S vaccines, cost-effectiveness studies are needed to help inform governments in resource-poor settings about how best to prioritize between the new vaccine and existing malaria interventions.METHODS: A Markov model simulated malaria progression in a hypothetical Malawian birth cohort. Parameters were based on published data. Three strategies were compared: no intervention, vaccination at one year, and long-lasting, insecticide-treated nets (LLINs) at birth. Both health service and societal perspectives were explored. Health outcomes were measured in disability-adjusted life years (DALYs) averted and costed in 2012 US$. Incremental cost-effectiveness ratios (ICERs) were calculated and extensive sensitivity analyses were conducted. Three times GDP per capita ($1,095) per DALY averted was used for a cost-effectiveness threshold, whilst one times GDP ($365) was considered 'very cost-effective'.RESULTS: From a societal perspective the vaccine strategy was dominant. It averted 0.11 more DALYs than LLINs and 0.372 more DALYs than the no intervention strategy per person, while costing $10.04 less than LLINs and $59.74 less than no intervention. From a health service perspective the vaccine's ICER was $145.03 per DALY averted, and thus can be considered very cost-effective. The results were robust to changes in all variables except the vaccine and LLINs' duration of efficacy. Vaccines remained cost-effective even at the lowest assumed efficacy levels of 49.6% (mild malaria) and 14.2% (severe malaria), and the highest price of $15. However, from a societal perspective, if the vaccine duration efficacy was set below 2.69 years or the LLIN duration of efficacy was greater than 4.24 years then LLINs became the more cost-effective strategy.CONCLUSION: The results showed that vaccinating Malawian children with RTS,S vaccines was very cost-effective from both a societal and a health service perspective. This result was robust to changes in most variables, including vaccine price and vaccine efficacy, but was sensitive to the duration of efficacy of the vaccine and LLINs. Given the best evidence currently available, vaccines can be considered as a very cost-effective component of Malawi's future malaria control programmes. However, long-term follow-up studies on both interventions are needed."
Use of vaccines as probes to define disease burden.,eng,United Kingdom,S0140-6736(13)61682-7,2014,Feikin,Daniel R,DR,Gessner,Bradford D,BD,S0140-6736(13)61682-7,"Vaccine probe studies have emerged in the past 15 years as a useful way to characterise disease. By contrast, traditional studies of vaccines focus on defining the vaccine effectiveness or efficacy. The underlying basis for the vaccine probe approach is that the difference in disease burden between vaccinated and unvaccinated individuals can be ascribed to the vaccine-specific pathogen. Vaccine probe studies can increase understanding of a vaccine's public health value. For instance, even when a vaccine has a seemingly low efficacy, a high baseline disease incidence can lead to a large vaccine-preventable disease burden and thus that population-based vaccine introduction would be justified. So far, vaccines have been used as probes to characterise disease syndromes caused by Haemophilus influenzae type b, pneumococcus, rotavirus, and early infant influenza. However, vaccine probe studies have enormous potential and could be used more widely in epidemiology, for example, to define the vaccine-preventable burden of malaria, typhoid, paediatric influenza, and dengue, and to identify causal interactions between different pathogens."
Immunization with the Leishmania infantum recombinant cyclophilin protein 1 confers partial protection to subsequent parasite infection and generates specific memory T cells.,eng,Netherlands,24486368,2014,Santos-Gomes,G M,GM,Tomás,A M,AM,24486368,"Control of zoonotic visceral leishmaniosis can be achieved using several available drugs. These drugs present high toxicity and require longer treatment regimens which complicate compliance to the treatment. Other control measures directed to the vector or the reservoirs are useful tools to restrain the spreading of this disease but the effects are transitory. A safe, affordable and efficient vaccine conferring long lasting immunity should be the most cost effective way of controlling zoonotic visceral leishmaniosis. The present study aims at characterizing a cyclophilin protein 1 of Leishmania infantum (LiCyP1) and investigating whether recombinant LiCyP1 (LirCyP1) is able to confer protection against infection by evaluating viable parasite load and the generation of specific CD4(+) and CD8(+) effector and central memory T cells in rodent model. LiCyP1 is present in the cytoplasm of L. infantum amastigotes and promastigotes. Immunization of BALB/c mice with LirCyP1 confers high protection to L. infantum infection, causing a marked reduction in parasite replication in the liver and spleen. Furthermore, helper and cytotoxic memory T cell subsets able to specifically recognize parasite antigens expanded in immunized and in challenged mice. CD4(+) T cell subpopulation of intermediate phenotype (CD62L(high)CD127(low)) of challenging mice also presented an accentuated expansion after the recall. This study demonstrated that LirCyP1 confers partial protection to L. infantum infection, promoting the generation of a desired long lasting immunity. LirCyP1 can be considered a potential candidate for the design of a vaccine against zoonotic visceral leishmaniosis."
Successful vaccines for naturally occurring protozoal diseases of animals should guide human vaccine research. A review of protozoal vaccines and their designs.,eng,England,S0031182013002060,2014,McAllister,Milton M,MM,McAllister,Milton M,MM,S0031182013002060,"Effective vaccines are available for many protozoal diseases of animals, including vaccines for zoonotic pathogens and for several species of vector-transmitted apicomplexan haemoparasites. In comparison with human diseases, vaccine development for animals has practical advantages such as the ability to perform experiments in the natural host, the option to manufacture some vaccines in vivo, and lower safety requirements. Although it is proper for human vaccines to be held to higher standards, the enduring lack of vaccines for human protozoal diseases is difficult to reconcile with the comparatively immense amount of research funding. Common tactical problems of human protozoal vaccine research include reliance upon adapted rather than natural animal disease models, and an overwhelming emphasis on novel approaches that are usually attempted in replacement of rather than for improvement upon the types of designs used in effective veterinary vaccines. Currently, all effective protozoal vaccines for animals are predicated upon the ability to grow protozoal organisms. Because human protozoal vaccines need to be as effective as animal vaccines, researchers should benefit from a comparison of existing veterinary products and leading experimental vaccine designs. With this in mind, protozoal vaccines are here reviewed."
Study of adverse events following immunisation with universal and newer vaccines in the Serampore IMA Child Clinic over a period of 7 years.,eng,India,24475552,2014,Das,Pradip Kumar,PK,Das,Pradip Kumar,PK,24475552,"Immunisation is an important part of childcare practice. It is one of the most beneficial and cost effective measures for the prevention of diseases. From the previous retrospective studies, it was evident that smallpox has been completely eradicated throughout now-a-days with the wholehearted and sincere efforts of healthcare providers by applying efficient and safe vaccine against smallpox, same is true also to polio which is now close to worldwide eradication and measles and rubella are no longer endemic in certain parts of the world. Not only has that with the introduction of safer and more efficient newer vaccines, the incidence of most other vaccine preventable disease of childhood also reduced considerably. The aim of the present study is to estimate the incidence and clinical presentation of adverse events following immunisation with universal and newer vaccines for a period of seven years using prospective active surveillance. Children under the age of 7 years were taken for universal and newer scheduled vaccinations given in the Serampore IMA Child Clinic under the supervision of the clinicians maintaining strictly the guidelines of Expanded Programme of Immunisation (Government of India). This study of adverse events following immunisation in the Serampore IMA Child Clinic confirms that the adverse events such as fever (0.37%), pain and swelling at the site of injection (0.32%0, urticarial rash (0.02%), anaphylactic shock (0.003%) are negligible. There were only two reports of anaphylaxis following preschool and infant schedule vaccines, including measles, mumps and rubella (MMR), Haemophilus influenzae type B vaccines and typhoid vaccines in approximately 52,000 infants received over a period of 7 years starting from 1st April, 2005 to 31st March, 2012 and there were no deaths or longterm effects reported during the post follow-up period in the Serampore IMA Child Clinic."
Developing inexpensive malaria vaccines from plants and algae.,eng,Germany,10.1007/s00253-013-5477-6,2014,Gregory,James A,JA,Mayfield,Stephen P,SP,10.1007/s00253-013-5477-6,"Malaria is a parasitic, mosquito-borne, infectious disease that threatens nearly half of the global population. The last decade has seen a dramatic drop in the number of malaria-related deaths because of vector control methods and anti-malarial drugs. Unfortunately, this strategy is not sustainable because of the emergence of insecticide-resistant mosquitoes and drug-resistant Plasmodium parasites. Eradication of malaria will ultimately require low-cost easily administered vaccines that work in concert with current control methods. Low cost and ease of administration will be essential components of any vaccine, because malaria endemic regions are poor and often lack an adequate healthcare infrastructure. Recently, several groups have begun addressing these issues using inexpensive photosynthetic organisms for producing vaccine antigens and exploring oral delivery strategies. Immune responses from plant-based injectable malaria vaccines are promising, but attempts to adapt these for oral delivery suggest we are far from a feasible strategy. Here, we review examples of these technologies and discuss the progress and potential of this research, as well as the obstacles ahead."
Coercion and polio eradication efforts in Moradabad.,eng,United States,27667,2014,Rentmeester,Christy A,CA,Packard,Randall M,RM,27667,"We introduce the problem of vaccine coercion as reported in Moradabad, India. We offer commentary and critical analysis on ethical complexities at the intersection of global public health and regional political strife and relate them to broader vaccine goals. We draw upon a historical example from malaria vaccine efforts, focusing specifically on ethical and health justice issues expressed through the use of coercion in vaccine administration. We suggest how coercion is indicative of failed leadership in public health and consider community-based collaborations as models for cultivating local investment and trust in vaccination campaigns and for success in global public health initiatives."
The potential acceptability of infant vaccination against malaria: A mapping of parental positions in Togo.,eng,Netherlands,26706273,2015,Kpanake,Lonzozou,L,Mullet,Etienne,E,26706273,"OBJECTIVE: To map the acceptability to parents in Togo of infant vaccination against malaria.METHODS: From July to October 2014, a study of 209 parents of infants in Togo was conducted to assess their willingness to have their infants vaccinated against malaria. Participants were exposed to 48 vignettes, designed using the main constructs of health-protective theories.RESULTS: Five qualitatively different positions were found, which were labeled Neighbors' Attitude (5%), Cost Only (21%), Neighbors' Attitude and Cost (22%), Risk and Cost (33%), and Always Vaccine (20%).CONCLUSION: The diversity of parental positions regarding vaccinating their infants against malaria implies that malaria vaccination campaigns in Togo, and possibly in other sub-Saharan African countries, must not be &quot;one size fits all,&quot; but must be tailored in design and implementation to match the diversity of parents' needs and views."
"Benchmarking health system performance across regions in Uganda: a systematic analysis of levels and trends in key maternal and child health interventions, 1990-2011.",eng,England,10.1186/s12916-015-0518-x,2015,Roberts,D Allen,DA,Gakidou,Emmanuela,E,10.1186/s12916-015-0518-x,"BACKGROUND: Globally, countries are increasingly prioritizing the reduction of health inequalities and provision of universal health coverage. While national benchmarking has become more common, such work at subnational levels is rare. The timely and rigorous measurement of local levels and trends in key health interventions and outcomes is vital to identifying areas of progress and detecting early signs of stalled or declining health system performance. Previous studies have yet to provide a comprehensive assessment of Uganda's maternal and child health (MCH) landscape at the subnational level.METHODS: By triangulating a number of different data sources - population censuses, household surveys, and administrative data - we generated regional estimates of 27 key MCH outcomes, interventions, and socioeconomic indicators from 1990 to 2011. After calculating source-specific estimates of intervention coverage, we used a two-step statistical model involving a mixed-effects linear model as an input to Gaussian process regression to produce regional-level trends. We also generated national-level estimates and constructed an indicator of overall intervention coverage based on the average of 11 high-priority interventions.RESULTS: National estimates often veiled large differences in coverage levels and trends across Uganda's regions. Under-5 mortality declined dramatically, from 163 deaths per 1,000 live births in 1990 to 85 deaths per 1,000 live births in 2011, but a large gap between Kampala and the rest of the country persisted. Uganda rapidly scaled up a subset of interventions across regions, including household ownership of insecticide-treated nets, receipt of artemisinin-based combination therapies among children under 5, and pentavalent immunization. Conversely, most regions saw minimal increases, if not actual declines, in the coverage of indicators that required multiple contacts with the health system, such as four or more antenatal care visits, three doses of oral polio vaccine, and two doses of intermittent preventive therapy during pregnancy. Some of the regions with the lowest levels of overall intervention coverage in 1990, such as North and West Nile, saw marked progress by 2011; nonetheless, sizeable disparities remained between Kampala and the rest of the country. Countrywide, overall coverage increased from 40% in 1990 to 64% in 2011, but coverage in 2011 ranged from 57% to 70% across regions.CONCLUSIONS: The MCH landscape in Uganda has, for the most part, improved between 1990 and 2011. Subnational benchmarking quantified the persistence of geographic health inequalities and identified regions in need of additional health systems strengthening. The tracking and analysis of subnational health trends should be conducted regularly to better guide policy decisions and strengthen responsiveness to local health needs."
"Public health impact and cost-effectiveness of the RTS,S/AS01 malaria vaccine: a systematic comparison of predictions from four mathematical models.",eng,United Kingdom,S0140-6736(15)00725-4,2015,Penny,Melissa A,MA,Ghani,Azra C,AC,S0140-6736(15)00725-4,"BACKGROUND: The phase 3 trial of the RTS,S/AS01 malaria vaccine candidate showed modest efficacy of the vaccine against Plasmodium falciparum malaria, but was not powered to assess mortality endpoints. Impact projections and cost-effectiveness estimates for longer timeframes than the trial follow-up and across a range of settings are needed to inform policy recommendations. We aimed to assess the public health impact and cost-effectiveness of routine use of the RTS,S/AS01 vaccine in African settings.METHODS: We compared four malaria transmission models and their predictions to assess vaccine cost-effectiveness and impact. We used trial data for follow-up of 32 months or longer to parameterise vaccine protection in the group aged 5-17 months. Estimates of cases, deaths, and disability-adjusted life-years (DALYs) averted were calculated over a 15 year time horizon for a range of levels of Plasmodium falciparum parasite prevalence in 2-10 year olds (PfPR2-10; range 3-65%). We considered two vaccine schedules: three doses at ages 6, 7·5, and 9 months (three-dose schedule, 90% coverage) and including a fourth dose at age 27 months (four-dose schedule, 72% coverage). We estimated cost-effectiveness in the presence of existing malaria interventions for vaccine prices of US$2-10 per dose.FINDINGS: In regions with a PfPR2-10 of 10-65%, RTS,S/AS01 is predicted to avert a median of 93,940 (range 20,490-126,540) clinical cases and 394 (127-708) deaths for the three-dose schedule, or 116,480 (31,450-160,410) clinical cases and 484 (189-859) deaths for the four-dose schedule, per 100,000 fully vaccinated children. A positive impact is also predicted at a PfPR2-10 of 5-10%, but there is little impact at a prevalence of lower than 3%. At $5 per dose and a PfPR2-10 of 10-65%, we estimated a median incremental cost-effectiveness ratio compared with current interventions of $30 (range 18-211) per clinical case averted and $80 (44-279) per DALY averted for the three-dose schedule, and of $25 (16-222) and $87 (48-244), respectively, for the four-dose schedule. Higher ICERs were estimated at low PfPR2-10 levels.INTERPRETATION: We predict a significant public health impact and high cost-effectiveness of the RTS,S/AS01 vaccine across a wide range of settings. Decisions about implementation will need to consider levels of malaria burden, the cost-effectiveness and coverage of other malaria interventions, health priorities, financing, and the capacity of the health system to deliver the vaccine.FUNDING: PATH Malaria Vaccine Initiative; Bill &amp; Melinda Gates Foundation; Global Good Fund; Medical Research Council; UK Department for International Development; GAVI, the Vaccine Alliance; WHO."
"Implementation of the malaria candidate vaccine RTS,S/AS01.",eng,England,S0140-6736(15)00807-7,2015,Greenwood,Brian,B,Doumbo,Ogobara K,OK,S0140-6736(15)00807-7,
"Costing RTS,S introduction in Burkina Faso, Ghana, Kenya, Senegal, Tanzania, and Uganda: A generalizable approach drawing on publicly available data.",eng,Netherlands,26518406,2015,Galactionova,Katya,K,Tediosi,Fabrizio,F,26518406,"Recent results from the phase 3 trial of RTS,S/AS01 malaria vaccine show that the vaccine induced partial protection against clinical malaria in infants and children; given the high burden of the disease it is currently considered for use in malaria endemic countries. To inform adoption decisions the paper proposes a generalizable methodology to estimate the cost of vaccine introduction using routinely collected and publicly available data from the cMYP, UNICEF, and WHO-CHOICE. Costing is carried out around a set of generic activities, assumptions, and inputs for delivery of immunization services adapted to a given country and deployment modality to capture among other factors the structure of the EPI program, distribution model, geography, and demographics particular to the setting. The methodology is applied to estimate the cost of RTS,S introduction in Burkina Faso, Ghana, Kenya, Senegal, Tanzania, and Uganda. At an assumed vaccine price of $5 per dose and given our assumptions on coverage and deployment strategy, we estimate total economic program costs for a 6-9 months cohort within $23.11-$28.28 per fully vaccinated child across the 6 countries. Net of procurement, costs at country level are substantial; for instance in Tanzania these could add as much as $4.2 million per year or an additional $2.4 per infant depending on the level of spare capacity in the system. Differences in cost of vaccine introduction across countries are primarily driven by differences in cost of labour. Overall estimates generated with the methodology result in costs within the ranges reported for other new vaccines introduced in SSA and capture multiple sources of heterogeneity in costs across countries. Further validation with data from field trials will support use of the methodology while also serving as a validation for cMYP and WHO-CHOICE as resources for costing health interventions in the region."
Pooled Amplicon Deep Sequencing of Candidate Plasmodium falciparum Transmission-Blocking Vaccine Antigens.,eng,United States,ajtmh.15-0571,2015,Juliano,Jonathan J,JJ,Meshnick,Steven R,SR,ajtmh.15-0571,"Polymorphisms within Plasmodium falciparum vaccine candidate antigens have the potential to compromise vaccine efficacy. Understanding the allele frequencies of polymorphisms in critical binding regions of antigens can help in the designing of strain-transcendent vaccines. Here, we adopt a pooled deep-sequencing approach, originally designed to study P. falciparum drug resistance mutations, to study the diversity of two leading transmission-blocking vaccine candidates, Pfs25 and Pfs48/45. We sequenced 329 P. falciparum field isolates from six different geographic regions. Pfs25 showed little diversity, with only one known polymorphism identified in the region associated with binding of transmission-blocking antibodies among our isolates. However, we identified four new mutations among eight non-synonymous mutations within the presumed antibody-binding region of Pfs48/45. Pooled deep sequencing provides a scalable and cost-effective approach for the targeted study of allele frequencies of P. falciparum candidate vaccine antigens."
