title,language,country,id,year,first _author_last_name,first _author_first_name,first _author_initials,last _author_last_name,last _author_first_name,last _author_initials,id,abstract
Cerebral malaria: what is known and what is on research.,eng,France,S0035-3787(12)00609-1,2012,Gay,F,F,Moreno,A,A,S0035-3787(12)00609-1,"Malaria is still the world's major important parasitic disease and is responsible for the death of more people than any other communicable disease except tuberculosis. A major change in recent years has been the recognition that severe malaria, predominantly caused by Plasmodium falciparum, is a complex multi-system disorder presenting with a range of clinical features. Some surviving patients have an increased risk of neurological and cognitive deficits, behavioural difficulties and epilepsy, making cerebral malaria a leading cause of childhood neurodisability in the malaria transmission area. It is unclear how an intravascular parasite causes such brain injury. Understanding of these mechanisms is important to develop appropriate neuroprotective interventions. However, due to the high specificity of P. falciparum to the human host and to the fact that clinical studies in human are not always feasible, our knowledge about this syndrome mainly comes from autopsy studies which can only give us a limited view of this deadly syndrome. Efforts developed by the scientific community have shown that development of severe malaria probably results from a combination of parasite-specific factors such as adhesion and sequestration to the vascular endothelium, the release of bioactive molecules, together with host inflammatory responses and metabolic acidosis. Recent studies have shown that endothelial cells could play a central role in the onset of the severe malaria. Indeed, adhesion of parasitized erythrocytes to these cells could drive their activation, which could participate in the trigger of an immune response and haemostatic derangements. Moreover, death of endothelial cells could be at the origin of the blood-lung/brain barrier breakdown. Despite the efforts to find new mechanisms, which explain the physiopathology of severe malaria, research progress is slowed down by the lack of experimental models, which reproduce this complex multi-system disorder. In absence of a vaccine so far, the rapid diagnosis of the disease, an efficient treatment, a correct management and nursing care are the only weapons to control mortality due to P. falciparum. It is important to note that in the future, the treatment of severe malaria may involve adjuvant treatments in addition to a potent antimalarial drug. In the present review, we summarize both what is known and practically useful for a physician, and the most promising and current topics of research."
Ensemble modeling of the likely public health impact of a pre-erythrocytic malaria vaccine.,eng,United States,10.1371/journal.pmed.1001157,2012,Smith,Thomas,T,Tanner,Marcel,M,10.1371/journal.pmed.1001157,"BACKGROUND: The RTS,S malaria vaccine may soon be licensed. Models of impact of such vaccines have mainly considered deployment via the World Health Organization's Expanded Programme on Immunization (EPI) in areas of stable endemic transmission of Plasmodium falciparum, and have been calibrated for such settings. Their applicability to low transmission settings is unclear. Evaluations of the efficiency of different deployment strategies in diverse settings should consider uncertainties in model structure.METHODS AND FINDINGS: An ensemble of 14 individual-based stochastic simulation models of P. falciparum dynamics, with differing assumptions about immune decay, transmission heterogeneity, and treatment access, was constructed. After fitting to an extensive library of field data, each model was used to predict the likely health benefits of RTS,S deployment, via EPI (with or without catch-up vaccinations), supplementary vaccination of school-age children, or mass vaccination every 5 y. Settings with seasonally varying transmission, with overall pre-intervention entomological inoculation rates (EIRs) of two, 11, and 20 infectious bites per person per annum, were considered. Predicted benefits of EPI vaccination programs over the simulated 14-y time horizon were dependent on duration of protection. Nevertheless, EPI strategies (with an initial catch-up phase) averted the most deaths per dose at the higher EIRs, although model uncertainty increased with EIR. At two infectious bites per person per annum, mass vaccination strategies substantially reduced transmission, leading to much greater health effects per dose, even at modest coverage.CONCLUSIONS: In higher transmission settings, EPI strategies will be most efficient, but vaccination additional to the EPI in targeted low transmission settings, even at modest coverage, might be more efficient than national-level vaccination of infants. The feasibility and economics of mass vaccination, and the circumstances under which vaccination will avert epidemics, remain unclear. The approach of using an ensemble of models provides more secure conclusions than a single-model approach, and suggests greater confidence in predictions of health effects for lower transmission settings than for higher ones."
GSK plows ahead with EMA malaria vaccine submission.,eng,United States,nbt1213-1066a,2013,Bouchie,Aaron,A,Bouchie,Aaron,A,nbt1213-1066a,
Malaria elimination: needs assessment and priorities for the future.,eng,Italy,24240033,2013,El-Moamly,Amal,A,El-Moamly,Amal,A,24240033,"When the World Health Organization announced the goal of global eradication of malaria in 2007, questions were raised about the naivety of this proposition. Since then, experts have been divided about this goal. Some scientists suggest that when defeating malaria, elimination is a worthy and challenging aim, but this has to be done with modesty and thorough analysis. Others believe that it is time to repeat the experience of smallpox eradication and to open a whole new era for public health, the eradication of many diseases. The opposing view suggests that raising expectations and failing again may set malaria control back, rather than advance its cause. This literature review focuses on malaria elimination. It summarizes the history of malaria elimination, its success factors and reasons for failure, and the controversial issues in malaria elimination. The collected articles on the challenges of elimination, and the technical and financial feasibility that countries must appreciate before proceeding, are identified. Also, this review discusses the current global strategy to eliminate malaria and highlights the main concerns for future plans aimed at elimination. These plans foresee improving currently available diagnostic methods, therapeutic and prophylactic agents and protocols, vector control procedures, vaccine development progress, and other operational tools and approaches. Finally, this review addresses a number of research priorities in the present stage of the fight against malaria."
Infectious disease research investments: systematic analysis of immunology and vaccine research funding in the UK.,eng,United Kingdom,24176489,2013,Fitchett,Joseph R,JR,Atun,Rifat,R,24176489,"Financing for global health is a critical element of research and development. Innovations in new vaccines are critically dependent on research funding given the large sums required, however estimates of global research investments are lacking. We evaluate infectious disease research investments, focusing on immunology and vaccine research by UK research funding organisations. In 1997-2010, £2.6 billion were spent by public and philanthropic organisations, with £590 million allocated to immunology and vaccine research. Preclinical studies received the largest funding amount £505 million accounting for 85.6% of total investment. In terms of specific infection, &quot;the big three&quot; infections dominated funding: HIV received £127 million (21.5% of total), malaria received £59 million (10.0% of total) and tuberculosis received £36 million (6.0% of total). We excluded industry funding from our analysis, as open-access data were unavailable. A global investment surveillance system is needed to map and monitor funding and guide allocation of scarce resources."
"Production, characterization, and immunogenicity of a secreted form of Plasmodium falciparum merozoite surface protein 4 produced in Bacillus subtilis.",eng,Germany,10.1007/s00253-013-5275-1,2013,Chittibabu,G,G,Coppel,Ross L,RL,10.1007/s00253-013-5275-1,"Plasmodium falciparum is the causative agent of the most serious form of malaria. Although a combination of control measures has significantly limited malaria morbidity and mortality in the last few years, it is generally agreed that sustained control or even eradication will require additional tools including an effective malaria vaccine. Merozoite surface protein 4, MSP4, which is present during the asexual stage of P. falciparum, is a recognized target that would be useful in a subunit vaccine against blood stages of malaria. Falciparum malaria is most prevalent in developing countries, and this in turn leads to a requirement for safe, low-cost vaccines. We have attempted to utilize the nonpathogenic, gram-positive organism Bacillus subtilis to produce PfMSP4. PfMSP4 was secreted into the culture medium at a yield of 4.5 mg/L. Characterization studies including SDS-PAGE, mass spectrometry, and N-terminal sequencing indicated that the B. subtilis expression system secreted a full length PfMSP4 protein compared to a truncated version in Escherichia coli. Equivalent amounts of purified B. subtilis and E. coli-derived PfMSP4 were used for immunization studies, resulting in statistically significant higher mean titer values for the B. subtilis-derived immunogen. The mouse antibodies raised against B. subtilis produced PfMSP4 that were reactive to parasite proteins as evidenced by immunoblotting on parasite lysate and indirect immunofluorescence assays of fixed parasites. The B. subtilis expression system, in contrast to E. coli, expresses higher amounts of full length PfMSP4 products, decreased levels of aggregates, and allows the development of simplified downstream processing procedures."
Antibacterial vaccine research in 21st century: from inoculation to genomics approaches.,eng,Netherlands,CTMC-EPUB-56367,2013,Altindis,Emrah,E,Altindis,Emrah,E,CTMC-EPUB-56367,"Vaccination is one of the safest and most cost-effective public health interventions, which save millions of lives annually. Thanks to all the genius pioneers of the field, we have already developed many effective vaccines. On the other hand, there are still many pathogens for which we do not yet have an effective or optimal vaccine, including malaria, HIV, and tuberculosis. In the 21(st) century, biological sciences are at the edge of a growing and fruitful genomics era, which provide many opportunities for vaccine research to have a better understanding of host-pathogen interactions, immune responses, targets and thus allow the scientists to design better vaccines. After the publication of the first bacterial genome of a pathogen, Haemophilus influenza, genomics technology revolutionized the field and created novel vaccine discovery approaches like reverse vaccinology, antigenome technology, surfome analysis, immunoproteomics, and genetics vaccinology to discover novel immunogenic antigens. This review is an attempt to briefly explain these methodologies and the history of their development since the beginning of the century."
Transfected HEK293 cells expressing functional recombinant intercellular adhesion molecule 1 (ICAM-1)--a receptor associated with severe Plasmodium falciparum malaria.,eng,United Kingdom,10.1371/journal.pone.0069999,2013,Bengtsson,Anja,A,Jensen,Anja T R,AT,10.1371/journal.pone.0069999,"Intercellular adhesion molecule 1 (ICAM-1) is a membrane-bound glycoprotein expressed on endothelial cells and cells of the immune system. Human ICAM-1 mediates adhesion and migration of leucocytes, and is implicated in inflammatory pathologies, autoimmune diseases and in many cancer processes. Additionally, ICAM-1 acts as receptor for pathogens like human rhinovirus and Plasmodium falciparum malaria parasites. A group of related P. falciparum erythrocyte membrane protein 1 (PfEMP1) domains, the DBLβ, mediates ICAM-1 binding of P. falciparum-infected erythrocytes. This ICAM‑1-binding phenotype has been suggested to be involved in the development of cerebral malaria. However, more studies identifying cross-reactive antibody and ICAM-1-binding epitopes and the establishment of a clinical link between DBLβ expression and e.g. cerebral malaria are needed before the DBLβ domains can be put forward as vaccine candidates and go into clinical trials. Such studies require availability of functional recombinant ICAM-1 in large quantities. In this study, we compared recombinant ICAM-1 expressed in HEK293 and COS-7 cells with mouse myeloma NS0 ICAM-1 purchased from a commercial vendor in terms of protein purity, yield, fold, ability to bind DBLβ, and relative cost. We present a HEK293 cell-based, high-yield expression and purification scheme for producing inexpensive, functional ICAM‑1. ICAM-1 expressed in HEK293 is applicable to malaria research and can also be useful in other research fields."
[Information analysis of development of researches on global neglected tropical diseases].,chi,China,23894837,2013,Xu,Xiao-Lin,XL,Guo,Jia-Gang,JG,23894837,"OBJECTIVE: To reveal the development and evolution pathway of global neglected tropical diseases (NTDs) from the bibliometrics and information visualization perspective.METHODS: The research publications on the subject of NTDs from Web of Science, PubMed and PLoS NTD were retrieved and analyzed by using the bibliometrics analysis, visualization analysis and citation strategic diagrams.RESULTS: The number of publications on the subject of NTDs from 2005 to 2013 had being growing gradually year by year, but there were some differences from disease to disease. The distribution of the authors, organizations and countries of the publications could be classified into two clusters, one was represented by US and UK and the other was represented by Switzerland and China. The research subjects of the publications contained epidemiology, laboratory and social economics based on population and animals. Six key and hot topics were revealed as follows: the disease burden; incorporating the control of NTDs into the programs of HIV/AIDS, tuberculosis, and malaria; comprehensive control strategies and their influence factors; human chemotherapy and its influence factors; vaccine; research and development innovation.CONCLUSION: The NTDs research in the globe is on its developing way with both challenges and opportunities, more concerns and investments, as well as the cooperations among different countries, organizations and disciplines are needed."
Dry-coated live viral vector vaccines delivered by nanopatch microprojections retain long-term thermostability and induce transgene-specific T cell responses in mice.,eng,United Kingdom,10.1371/journal.pone.0067888,2013,Pearson,Frances E,FE,Kendall,Mark A F,MA,10.1371/journal.pone.0067888,"The disadvantages of needle-based immunisation motivate the development of simple, low cost, needle-free alternatives. Vaccine delivery to cutaneous environments rich in specialised antigen-presenting cells using microprojection patches has practical and immunological advantages over conventional needle delivery. Additionally, stable coating of vaccine onto microprojections removes logistical obstacles presented by the strict requirement for cold-chain storage and distribution of liquid vaccine, or lyophilised vaccine plus diluent. These attributes make these technologies particularly suitable for delivery of vaccines against diseases such as malaria, which exerts its worst effects in countries with poorly-resourced healthcare systems. Live viral vectors including adenoviruses and poxviruses encoding exogenous antigens have shown significant clinical promise as vaccines, due to their ability to generate high numbers of antigen-specific T cells. Here, the simian adenovirus serotype 63 and the poxvirus modified vaccinia Ankara--two vectors under evaluation for the delivery of malaria antigens to humans--were formulated for coating onto Nanopatch microprojections and applied to murine skin. Co-formulation with the stabilising disaccharides trehalose and sucrose protected virions during the dry-coating process. Transgene-specific CD8(+) T cell responses following Nanopatch delivery of both vectors were similar to intradermal injection controls after a single immunisation (despite a much lower delivered dose), though MVA boosting of pre-primed responses with Nanopatch was found to be less effective than the ID route. Importantly, disaccharide-stabilised ChAd63 could be stored for 10 weeks at 37°C with less than 1 log10 loss of viability, and retained single-dose immunogenicity after storage. These data support the further development of microprojection patches for the deployment of live vaccines in hot climates."
Modeling the public health impact of malaria vaccines for developers and policymakers.,eng,England,1471-2334-13-295,2013,Nunes,Julia K,JK,Brooks,Alan,A,1471-2334-13-295,"BACKGROUND: Efforts to develop malaria vaccines show promise. Mathematical model-based estimates of the potential demand, public health impact, and cost and financing requirements can be used to inform investment and adoption decisions by vaccine developers and policymakers on the use of malaria vaccines as complements to existing interventions. However, the complexity of such models may make their outputs inaccessible to non-modeling specialists. This paper describes a Malaria Vaccine Model (MVM) developed to address the specific needs of developers and policymakers, who need to access sophisticated modeling results and to test various scenarios in a user-friendly interface. The model's functionality is demonstrated through a hypothetical vaccine.METHODS: The MVM has three modules: supply and demand forecast; public health impact; and implementation cost and financing requirements. These modules include pre-entered reference data and also allow for user-defined inputs. The model includes an integrated sensitivity analysis function. Model functionality was demonstrated by estimating the public health impact of a hypothetical pre-erythrocytic malaria vaccine with 85% efficacy against uncomplicated disease and a vaccine efficacy decay rate of four years, based on internationally-established targets. Demand for this hypothetical vaccine was estimated based on historical vaccine implementation rates for routine infant immunization in 40 African countries over a 10-year period. Assumed purchase price was $5 per dose and injection equipment and delivery costs were $0.40 per dose.RESULTS: The model projects the number of doses needed, uncomplicated and severe cases averted, deaths and disability-adjusted life years (DALYs) averted, and cost to avert each. In the demonstration scenario, based on a projected demand of 532 million doses, the MVM estimated that 150 million uncomplicated cases of malaria and 1.1 million deaths would be averted over 10 years. This is equivalent to 943 uncomplicated cases and 7 deaths averted per 1,000 vaccinees. In discounted 2011 US dollars, this represents $11 per uncomplicated case averted and $1,482 per death averted. If vaccine efficacy were reduced to 75%, the estimated uncomplicated cases and deaths averted over 10 years would decrease by 14% and 19%, respectively.CONCLUSIONS: The MVM can provide valuable information to assist decision-making by vaccine developers and policymakers, information which will be refined and strengthened as field studies progress allowing further validation of modeling assumptions."
Alga-produced cholera toxin-Pfs25 fusion proteins as oral vaccines.,eng,United States,AEM.00714-13,2013,Gregory,James A,JA,Mayfield,Stephen,S,AEM.00714-13,"Infectious diseases disproportionately affect indigent regions and are the greatest cause of childhood mortality in developing countries. Practical, low-cost vaccines for use in these countries are paramount to reducing disease burdens and concomitant poverty. Algae are a promising low-cost system for producing vaccines that can be orally delivered, thereby avoiding expensive purification and injectable delivery. We engineered the chloroplast of the eukaryotic alga Chlamydomonas reinhardtii to produce a chimeric protein consisting of the 25-kDa Plasmodium falciparum surface protein (Pfs25) fused to the β subunit of the cholera toxin (CtxB) to investigate an alga-based whole-cell oral vaccine. Pfs25 is a promising malaria transmission-blocking vaccine candidate that has been difficult to produce in traditional recombinant systems due to its structurally complex tandem repeats of epidermal growth factor-like domains. The noncatalytic CtxB domain of the cholera holotoxin assembles into a pentameric structure and acts as a mucosal adjuvant by binding GM1 ganglioside receptors on gut epithelial cells. We demonstrate that CtxB-Pfs25 accumulates as a soluble, properly folded and functional protein within algal chloroplasts, and it is stable in freeze-dried alga cells at ambient temperatures. In mice, oral vaccination using freeze-dried algae that produce CtxB-Pfs25 elicited CtxB-specific serum IgG antibodies and both CtxB- and Pfs25-specific secretory IgA antibodies. These data suggest that algae are a promising system for production and oral delivery of vaccine antigens, but as an orally delivered adjuvant, CtxB is best suited for eliciting secretory IgA antibodies for vaccine antigens against pathogens that invade mucosal surfaces using this strategy."
"Vaccines today, vaccines tomorrow: a perspective.",eng,Korea (South),10.7774/cevr.2013.2.1.4,2013,Loucq,Christian,C,Loucq,Christian,C,10.7774/cevr.2013.2.1.4,"Vaccines are considered as one of the major contributions of the 20th century and one of the most cost effective public health interventions. The International Vaccine Institute has as a mission to discover, develop and deliver new and improved vaccines against infectious diseases that affects developing nations. If Louis Pasteur is known across the globe, vaccinologists like Maurice Hilleman, Jonas Salk and Charles Mérieux are known among experts only despite their contribution to global health. Thanks to a vaccine, smallpox has been eradicated, polio has nearly disappeared, Haemophilus influenzae B, measles and more recently meningitis A are controlled in many countries. While a malaria vaccine is undergoing phase 3, International Vaccine Institute, in collaboration with an Indian manufacturer has brought an oral inactivated cholera vaccine to pre-qualification. The field of vaccinology has undergone major changes thanks to philanthropists such as Bill and Melinda Gates, initiatives like the Decade of Vaccines and public private partnerships. Current researches on vaccines have more challenging targets like the dengue viruses, malaria, human immunodeficiency virus, the respiratory syncytial virus and nosocomial diseases. Exciting research is taking place on new adjuvants, nanoparticles, virus like particles and new route of administration. An overcrowded infant immunization program, anti-vaccine groups, immunizing a growing number of elderlies and delivering vaccines to difficult places are among challenges faced by vaccinologists and global health experts."
Malaria vaccines: high-throughput tools for antigens discovery with potential for their development.,eng,Colombia,24892459,2013,Céspedes,Nora,N,Herrera,Sócrates,S,24892459,"Malaria is a disease induced by parasites of the Plasmodium genus, which are transmitted by Anopheles mosquitoes and represents a great socio-economic burden Worldwide. Plasmodium vivax is the second species of malaria Worldwide, but it is the most prevalent in Latin America and other regions of the planet. It is currently considered that vaccines represent a cost-effective strategy for controlling transmissible diseases and could complement other malaria control measures; however, the chemical and immunological complexity of the parasite has hindered development of effective vaccines. Recent availability of several genomes of Plasmodium species, as well as bioinformatic tools are allowing the selection of large numbers of proteins and analysis of their immune potential. Herein, we review recently developed strategies for discovery of novel antigens with potential for malaria vaccine development.Abstract available from the publisher."
