,title,language,country,id,year,month,day,affiliation,first _author_last_name,first _author_first_name,first _author_initials,last _author_last_name,last _author_first_name,last _author_initials,all_authors,abstract,url,useful,row_number
750,Cost-effectiveness analysis of rotavirus vaccination among Libyan children using a simple economic model.,eng,Sweden,26236,2014,12,17,"Julius Centre, Department of Social and Preventive Medicine, Faculty of Medicine, University of Malaya, Kuala Lumpur, Malaysia; alkushis@yahoo.com.",Alkoshi,Salem,S,Dahlui,Maznah,M,"Salem Alkoshi, Namaitijiang Maimaiti, Maznah Dahlui","BACKGROUND: Rotavirus infection is a major cause of childhood diarrhea in Libya. The objective of this study is to evaluate the cost-effectiveness of rotavirus vaccination in that country.METHODS: We used a published decision tree model that has been adapted to the Libyan situation to analyze a birth cohort of 160,000 children. The evaluation of diarrhea events in three public hospitals helped to estimate the rotavirus burden. The economic analysis was done from two perspectives: health care provider and societal. Univariate sensitivity analyses were conducted to assess uncertainty in some values of the variables selected.RESULTS: The three hospitals received 545 diarrhea patients aged≤5 with 311 (57%) rotavirus positive test results during a 9-month period. The societal cost for treatment of a case of rotavirus diarrhea was estimated at US$ 661/event. The incremental cost-effectiveness ratio with a vaccine price of US$ 27 per course was US$ 8,972 per quality-adjusted life year gained from the health care perspective. From a societal perspective, the analysis shows cost savings of around US$ 16 per child.CONCLUSION: The model shows that rotavirus vaccination could be economically a very attractive intervention in Libya.",http://www.ncbi.nlm.nih.gov/pubmed/?term=26236,no,139
759,"Towards Canine Rabies Elimination in KwaZulu-Natal, South Africa: Assessment of Health Economic Data.",ENG,NA,25414096,2014,11,22,"National Wildlife Research Center, USDA APHIS Wildlife Services, Fort Collins, CO, USA.",Shwiff,S A,SA,Rupprecht,C E,CE,"S A Shwiff, B Hatch, A Anderson, L H Nel, K Leroux, D Stewart, M de Scally, P Govender, C E Rupprecht","Rabies remains a significant problem throughout much of the developing world. An estimated 69 000 people die annually from exposure to rabies. Most of these deaths are the result of being bitten by a rabid dog. Mass vaccination campaigns targeting dogs have been implemented around the world in an attempt to control or eliminate canine rabies. We analysed the vaccination and cost data for a campaign in the KwaZulu-Natal province of South Africa; we found that the cost per dog vaccinated to be $6.61 for mass campaigns and $5.41 for local campaigns. We also estimated the cost of human post-exposure prophylaxis (PEP). The cost of PEP is approximately $64.50 on average per patient, and $333 on average for the 9% of patients who receive RIG. We also found that the districts that vaccinated the most dogs per capita experienced the highest rates of human treatment and thus had the highest PEP costs.",http://www.ncbi.nlm.nih.gov/pubmed/?term=25414096,no,140
776,The impact of introducing new vaccines on the health system: case studies from six low- and middle-income countries.,eng,Netherlands,25261379,2014,9,28,"London School of Hygiene &amp; Tropical Medicine, London, UK.",Burchett,Helen E D,HE,Mills,Anne,A,"Helen E D Burchett, Sandra Mounier-Jack, Sergio Torres-Rueda, Ulla K Griffiths, Pierre Ongolo-Zogo, Stephen Rulisa, Jean-Marie Edengue, Enrique Chavez, Yayehirad Kitaw, Mitike Molla, Mamadou Konate, Lawrence Gelmon, Washington Onyango-Ouma, Mylene Lagarde, Anne Mills","OBJECTIVE: We aimed to explore the impacts of new vaccine introductions on immunization programmes and health systems in low- and middle-income countries.METHODS: We conducted case studies of seven vaccine introductions in six countries (Cameroon, PCV;Ethiopia, PCV; Guatemala, rotavirus; Kenya, PCV; Mali, Meningitis A; Mali, PCV; Rwanda, HPV). Inter-views were conducted with 261 national, regional and district key informants and questionnaires were completed with staff from 196 health facilities. Routine data from districts and health facilities were gathered on vaccination and antenatal service use. Data collection and analysis were structured around the World Health Organisation health system building blocks.FINDINGS: The new vaccines were viewed positively and seemed to integrate well into existing health systems. The introductions were found to have had no impact on many elements within the building blocks framework. Despite many key informants and facility respondents perceiving that the new vaccine introductions had increased coverage of other vaccines, the routine data showed no change. Positive effects perceived included enhanced credibility of the immunisation programme and strengthened health workers' skills through training. Negative effects reported included an increase in workload and stock outs of the new vaccine, which created a perception in the community that all vaccines were out of stock in a facility. Most effects were found within the vaccination programmes; very few were reported on the broader health systems. Effects were primarily reported to be temporary, around the time of introduction only.CONCLUSION: Although the new vaccine introductions were viewed as intrinsically positive, on the whole there was no evidence that they had any major impact, positive or negative, on the broader health systems.",http://www.ncbi.nlm.nih.gov/pubmed/?term=25261379,no,142
779,Modelling the cost-effectiveness of a new infant vaccine to prevent tuberculosis disease in children in South Africa.,eng,England,10.1186/1478-7547-12-20,2014,9,23,"Health Economics Unit, School of Public Health and Family Medicine, Faculty of Health Sciences, University of Cape Town, Anzio Road, Observatory, 7925 Cape Town, South Africa.",Channing,Liezl,L,Sinanovic,Edina,E,"Liezl Channing, Edina Sinanovic","BACKGROUND: Tuberculosis remains the leading cause of death in South Africa. A number of potential new TB vaccine candidates have been identified and are currently in clinical trials. One such candidate is MVA85A. This study aimed to estimate the cost-effectiveness of adding the MVA85A vaccine as a booster to the BCG vaccine in children from the perspective of the South African government.METHODS: The cost-effectiveness was assessed by employing Decision Analytic Modelling, through the use of a Markov model. The model compared the existing strategy of BCG vaccination to a new strategy in which infants receive BCG and a booster vaccine, MVA85A, at 4 months of age. The costs and outcomes of the two strategies are estimated through modelling the vaccination of a hypothetical cohort of newborns and following them from birth through to 10 years of age, employing 6-monthly cycles.RESULTS: The results of the cost-effectiveness analysis indicate that the MVA85A strategy is both more costly and more effective - there are fewer TB cases and deaths from TB than BCG alone. The South African government would need to spend an additional USD 1,105 for every additional TB case averted and USD 284,017 for every additional TB death averted. The threshold analysis shows that, if the efficacy of the MVA85A vaccine was 41.3% (instead of the current efficacy of 17.3%), the two strategies would have the same cost but more cases of TB and more deaths from TB would be prevented by adding the MVA85A vaccine to the BCG vaccine. In this case, the government chould consider the MVA85A strategy.CONCLUSIONS: At the current level of efficacy, the MVA85A vaccine is neither effective nor cost-effective and, therefore, not a good use of limited resources. Nevertheless, this study contributes to developing a standardized Markov model, which could be used, in the future, to estimate the potential cost-effectiveness of new TB vaccines compared to the BCG vaccine, in children between the ages of 0-10 years. It also provides an indicative threshold of vaccine efficacy, which could guide future development.",http://www.ncbi.nlm.nih.gov/pubmed/?term=10.1186/1478-7547-12-20,no,143
784,Costs and cost-effectiveness of 9-valent human papillomavirus (HPV) vaccination in two East African countries.,eng,United States,10.1371/journal.pone.0106836,2014,9,10,"Harvard Interfaculty Initiative in Health Policy, Cambridge, Massachusetts, United States of America; Department of Obstetrics and Gynecology, Faculty of Medicine, Chulalongkorn University, Bangkok, Thailand; Sasin Graduate Institute of Business Administration of Chulalongkorn University, Bangkok, Thailand.",Kiatpongsan,Sorapop,S,Kim,Jane J,JJ,"Sorapop Kiatpongsan, Jane J Kim","BACKGROUND: Current prophylactic vaccines against human papillomavirus (HPV) target two of the most oncogenic types, HPV-16 and -18, which contribute to roughly 70% of cervical cancers worldwide. Second-generation HPV vaccines include a 9-valent vaccine, which targets five additional oncogenic HPV types (i.e., 31, 33, 45, 52, and 58) that contribute to another 15-30% of cervical cancer cases. The objective of this study was to determine a range of vaccine costs for which the 9-valent vaccine would be cost-effective in comparison to the current vaccines in two less developed countries (i.e., Kenya and Uganda).METHODS AND FINDINGS: The analysis was performed using a natural history disease simulation model of HPV and cervical cancer. The mathematical model simulates individual women from an early age and tracks health events and resource use as they transition through clinically-relevant health states over their lifetime. Epidemiological data on HPV prevalence and cancer incidence were used to adapt the model to Kenya and Uganda. Health benefit, or effectiveness, from HPV vaccination was measured in terms of life expectancy, and costs were measured in international dollars (I$). The incremental cost of the 9-valent vaccine included the added cost of the vaccine counterbalanced by costs averted from additional cancer cases prevented. All future costs and health benefits were discounted at an annual rate of 3% in the base case analysis. We conducted sensitivity analyses to investigate how infection with multiple HPV types, unidentifiable HPV types in cancer cases, and cross-protection against non-vaccine types could affect the potential cost range of the 9-valent vaccine. In the base case analysis in Kenya, we found that vaccination with the 9-valent vaccine was very cost-effective (i.e., had an incremental cost-effectiveness ratio below per-capita GDP), compared to the current vaccines provided the added cost of the 9-valent vaccine did not exceed I$9.7 per vaccinated girl. To be considered very cost-effective, the added cost per vaccinated girl could go up to I$5.2 and I$16.2 in the worst-case and best-case scenarios, respectively. At a willingness-to-pay threshold of three times per-capita GDP where the 9-valent vaccine would be considered cost-effective, the thresholds of added costs associated with the 9-valent vaccine were I$27.3, I$14.5 and I$45.3 per vaccinated girl for the base case, worst-case and best-case scenarios, respectively. In Uganda, vaccination with the 9-valent vaccine was very cost-effective when the added cost of the 9-valent vaccine did not exceed I$8.3 per vaccinated girl. To be considered very cost-effective, the added cost per vaccinated girl could go up to I$4.5 and I$13.7 in the worst-case and best-case scenarios, respectively. At a willingness-to-pay threshold of three times per-capita GDP, the thresholds of added costs associated with the 9-valent vaccine were I$23.4, I$12.6 and I$38.4 per vaccinated girl for the base case, worst-case and best-case scenarios, respectively.CONCLUSIONS: This study provides a threshold range of incremental costs associated with the 9-valent HPV vaccine that would make it a cost-effective intervention in comparison to currently available HPV vaccines in Kenya and Uganda. These prices represent a 71% and 61% increase over the price offered to the GAVI Alliance ($5 per dose) for the currently available 2- and 4-valent vaccines in Kenya and Uganda, respectively. Despite evidence of cost-effectiveness, critical challenges around affordability and feasibility of HPV vaccination and other competing needs in low-resource settings such as Kenya and Uganda remain.",http://www.ncbi.nlm.nih.gov/pubmed/?term=10.1371/journal.pone.0106836,no,144
787,Valuing vaccination.,eng,United Kingdom,25136129,2014,8,20,"Department of Global Health and Population, Harvard School of Public Health, Boston, MA 02115; and Africa Centre for Health and Population Studies, University of KwaZulu-Natal, Mtubatuba 3935, South Africa.",Bärnighausen,Till,T,O'Brien,Jennifer Carroll,JC,"Till Bärnighausen, David E Bloom, Elizabeth T Cafiero-Fonseca, Jennifer Carroll O'Brien","Vaccination has led to remarkable health gains over the last century. However, large coverage gaps remain, which will require significant financial resources and political will to address. In recent years, a compelling line of inquiry has established the economic benefits of health, at both the individual and aggregate levels. Most existing economic evaluations of particular health interventions fail to account for this new research, leading to potentially sizable undervaluation of those interventions. In line with this new research, we set forth a framework for conceptualizing the full benefits of vaccination, including avoided medical care costs, outcome-related productivity gains, behavior-related productivity gains, community health externalities, community economic externalities, and the value of risk reduction and pure health gains. We also review literature highlighting the magnitude of these sources of benefit for different vaccinations. Finally, we outline the steps that need to be taken to implement a broad-approach economic evaluation and discuss the implications of this work for research, policy, and resource allocation for vaccine development and delivery.",http://www.ncbi.nlm.nih.gov/pubmed/?term=25136129,no,145
795,"Evaluation of economic costs of a measles outbreak and outbreak response activities in Keffa Zone, Ethiopia.",eng,Netherlands,24951866,2014,6,22,"Global Immunization Division, Centers for Disease Control and Prevention, 1600 Clifton Road, MS-E05, Atlanta, GA 30329, USA. Electronic address: awallace@cdc.gov.",Wallace,Aaron S,AS,Vijayaraghavan,Maya,M,"Aaron S Wallace, Balcha G Masresha, Gavin Grant, James L Goodson, Hailye Birhane, Meseret Abraham, Tewodros B Endailalu, Yohannes Letamo, Amos Petu, Maya Vijayaraghavan","OBJECTIVE: To estimate the economic impact of a measles outbreak and response activities that occurred in Keffa Zone, Ethiopia with 5257 reported cases during October 1, 2011-April 8, 2012, using the health sector and household perspectives.METHODS: We collected cost input data through interviews and record reviews with government and partner agency staff and through a survey of 100 measles cases-patients and their caretakers. We used cost input data to estimate the financial and opportunity costs of the following outbreak and response activities: investigation, treatment, case management, active surveillance, immunization campaigns, and immunization system strengthening.FINDINGS: The economic cost of the outbreak and response was 758,869 United States dollars (US$), including the opportunity cost of US$327,545 (US$62.31/case) and financial cost of US$431,324 (US$82.05/case). Health sector costs, including the immunization campaign (US$72.29/case), accounted for 80% of the economic cost. Household economic cost was US$29.18/case, equal to 6% of the household median annual income. 92% of financial costs were covered by partner agencies.CONCLUSION: The economic cost of the measles outbreak was substantial when compared to household income and health sector expenditures. Improvement in two-dose measles vaccination coverage above 95% would both reduce measles incidence and save considerable outbreak-associated costs to both the health sector and households.",http://www.ncbi.nlm.nih.gov/pubmed/?term=24951866,no,146
796,Comparative performance of public and private sector delivery of BCG vaccination: evidence from Sub-Saharan Africa.,eng,Netherlands,24951863,2014,6,22,"School of Public Health, UC Berkeley, 50 University Hall, Berkeley, CA 94704, United States. Electronic address: zwagner@berkeley.edu.",Wagner,Zachary,Z,Sood,Neeraj,N,"Zachary Wagner, Peter G Szilagyi, Neeraj Sood","BACKGROUND: The private sector is an important source of health care in the developing world. However, there is limited evidence on how private providers compare to public providers, particularly for preventive services such as immunizations. We used data from Sub-Saharan Africa (SSA) to assess public-private differences in Bacillus Calmette-Guérin (BCG) vaccine delivery.METHODS AND FINDINGS: We used demographic and health surveys from 102,629 children aged 0-59 months from 29 countries across SSA to measure differences in BCG status for children born at private versus public health facilities (BCG is recommended at birth). We used a probit model to estimate public-private differences in BCG delivery, while controlling for key confounders. Next, we estimated how differences in BCG status evolved over time for children born at private versus public facilities. Finally, we estimated heterogeneity in public-private differences based on wealth and rural-urban residency. We found that children born at a private facility were 7.1 percentage points less likely to receive BCG vaccine in the same month as birth than children born at a public facility (95% CI 6.3-8.0; p&lt;0.001). Most of this difference was driven by for-profit private providers (as opposed to NGOs) where the BCG provision rate was 10.0 percentage points less than public providers (95% CI 9.0-11.2; p&lt;0.001) compared to only 2.4 percentage points for NGOs (95% CI 1.0-3. 8; p&lt;0.01). Moreover, children born at private for-profit facilities remained less likely to be vaccinated up to 59 months after birth. Finally, public-private differences were more pronounced for poorer children and children in rural areas.CONCLUSIONS: The for-profit private sector performed substantially worse than the public sector in providing BCG vaccine to newborns, resulting in a longer duration of vulnerability to tuberculosis. This disparity was greater for poorer children and children in rural areas.",http://www.ncbi.nlm.nih.gov/pubmed/?term=24951863,no,147
801,Effectiveness of pneumococcal conjugate vaccine and rotavirus vaccine introduction into the South African public immunisation programme.,eng,South Africa,24893498,2014,6,5,NA,Madhi,S A,SA,Ngcobo,N,N,"S A Madhi, L Bamford, N Ngcobo","Immunisation has contributed greatly to the control of vaccine-preventable diseases and therefore to improvements in health and survival, especially among young children, and remains one of the most successful and cost-effective public health interventions. This remains true for many of the newer, more expensive vaccines. Vaccines against invasive pneumococcal disease and rotavirus infection were introduced into the South African Expanded Programme on Immunization in April 2009. This article describes the rationale for and process of the introduction of these two vaccines, pneumococcal conjugate vaccine and rotavirus vaccine. It also aims to evaluate the success of and challenges related to their introduction, in terms of both achieving universal coverage and improving survival and health in South African children.",http://www.ncbi.nlm.nih.gov/pubmed/?term=24893498,no,148
807,The benefits of redesigning Benin's vaccine supply chain.,eng,Netherlands,24814550,2014,5,13,"Pittsburgh Supercomputing Center (PSC), Pittsburgh, PA, USA.",Brown,Shawn T,ST,Lee,Bruce Y,BY,"Shawn T Brown, Benjamin Schreiber, Brigid E Cakouros, Angela R Wateska, Hamadou M Dicko, Diana L Connor, Philippe Jaillard, Mercy Mvundura, Bryan A Norman, Carol Levin, Jayant Rajgopal, Mélanie Avella, Caroline Lebrun, Erin Claypool, Proma Paul, Bruce Y Lee","INTRODUCTION: New vaccine introductions have put strains on vaccine supply chains around the world. While increasing storage and transportation may be the most straightforward options, it is also important to consider what financial and operational benefits can be incurred. In 2012, suboptimal vaccine coverage and impending vaccine introductions prompted the Republic of Benin's Ministry of Health (MOH) to explore ways to improve their vaccine supply chain.METHODS: Working alongside the Beninese MOH, we utilized our computational model, HERMES, to explore the impact on cost and vaccine availability of three possible options: (1) consolidating the Commune level to a Health Zone level, (2) removing the Commune level completely, and (3) removing the Commune level and expanding to 12 Department Stores. We also analyzed the impact of adding shipping loops during delivery.RESULTS: At baseline, new vaccine introductions without any changes to the current system increased the logistics cost per dose ($0.23 to $0.26) and dropped the vaccine availability to 71%. While implementing the Commune level removal scenario had the same capital costs as implementing the Health Zone scenario, the Health Zone scenario had lower operating costs. This increased to an overall cost savings of $504,255 when implementing shipping loops.DISCUSSION: The best redesign option proved to be the synergistic approach of converting to the Health Zone design and using shipping loops (serving ten Health Posts/loop). While a transition to either redesign or only adding shipping loops was beneficial, implementing a redesign option and shipping loops can yield both lower capital expenditures and operating costs.",http://www.ncbi.nlm.nih.gov/pubmed/?term=24814550,no,149
814,Planning for human papillomavirus (HPV) vaccination in sub-Saharan Africa: a modeling-based approach.,eng,United States,24731734,2014,4,16,"Department of Epidemiology and Public Health, University of Maryland School of Medicine, United States; Department of Medicine, University of Maryland School of Medicine, United States. Electronic address: ktracy@epi.umaryland.edu.",Tracy,J Kathleen,JK,Gaff,Holly D,HD,"J Kathleen Tracy, Nicholas H Schluterman, Christina Greene, Samba O Sow, Holly D Gaff","BACKGROUND: Human papillomavirus (HPV) vaccines have the potential to reduce cervical cancer incidence and mortality, particularly in the parts of the developing world that bear the greatest burden of disease. This research sought to predict the impact and cost-effectiveness of an HPV vaccination program in an example low-resource country with a high burden of cervical cancer: Mali, West Africa.METHODS: Novel compartmental mathematical models projected the impact of adolescent HPV vaccination in urban and rural areas of Mali. The models accounted for two high-risk vaccine-types: HPV 16 and 18. We then attached comprehensive real cost and cost-effectiveness estimates.RESULTS: Our models predict that HPV vaccination in Mali will reduce cervical cancer burden by a factor roughly equal to vaccine coverage. A point vaccination program was simulated in a cohort of 333,146 urban and 588,982 rural Malian women, age 10-14. Vaccination of 50% of girls reduced the peak prevalence of HPV 16/18 to 5.0% in the urban setting and 9.6% in the rural setting, down from 11.7% and 22.0%, respectively, with no vaccination. The 50% vaccination scenario averted 1145 cervical cancer deaths in the urban group and 2742 in the rural group. The cost per discounted life-year saved in this scenario was 1030 US dollars (urban) and 725 dollars (rural). The cost per life-year saved was higher at 90% coverage, but was still in the range of a &quot;cost-effective&quot; public health intervention.CONCLUSIONS: This research yielded the most comprehensive real cost estimates of HPV vaccination yet published for sub-Saharan Africa. Our models indicate that HPV vaccination in Mali will be cost-effective when introduced. To maximize the benefit using limited resources, vaccination programs may begin with a target coverage of about 50%. We anticipate that costs of reaching late adopters after the First Vaccinated Wave of vaccination will be higher, but worthwhile.",http://www.ncbi.nlm.nih.gov/pubmed/?term=24731734,no,150
